{"answer":"The synthetic hosting invoice 4471 is due on October 13. Nothing in the archive says whether it was paid.","claims":[{"text":"Invoice 4471 is due on October 13.","basis":"evidence","citations":[{"chunkId":"src:body-v1:0","start":0,"end":56}]},{"text":"The invoice may still be unpaid.","basis":"hypothesis","citations":[]}],"gaps":["No payment confirmation was found."],"proposals":[]}
